{
  "version": "1.3.0",
  "locale": "ar-YE",
  "normalization": {
    "strip_diacritics": true,
    "strip_tatweel": true,
    "unify_alef": true,
    "ta_marbuta_to_ha": true,
    "alef_maqsura_to_ya": true,
    "allowed_proclitics": [
      "و",
      "ف",
      "ب",
      "ل",
      "ك",
      "ال"
    ]
  },
  "channels": {
    "patron": {
      "source": "زبائن المنشأة عبر نموذج الموقع أو الصفحة أو واتساب المنشأة",
      "default_route": "owner",
      "severity_routes": {
        "high": [
          "owner_whatsapp",
          "owner_portal"
        ],
        "critical": [
          "owner_whatsapp",
          "owner_portal",
          "founder_slack"
        ]
      },
      "copy_to_founder": [
        "legal",
        "safety"
      ]
    },
    "client": {
      "source": "صاحب المنشأة إلى فريق هيرمس",
      "default_route": "founder",
      "severity_routes": {
        "high": [
          "founder_slack"
        ],
        "critical": [
          "founder_sms",
          "founder_slack"
        ]
      },
      "copy_to_founder": [
        "pricing",
        "quality",
        "legal",
        "safety",
        "refund"
      ]
    }
  },
  "categories": [
    {
      "id": "pricing",
      "severity": "high",
      "sla_minutes": 30,
      "reason": "الوكيل غير مصرّح بتأكيد أو نفي أي سعر أو فاتورة.",
      "keywords": [
        "غلط في السعر",
        "سعر خاطئ",
        "زودتوا السعر",
        "الفاتورة غلط",
        "دفعت أكثر",
        "دفعت مرتين",
        "الدفعة ما وصلت",
        "الحساب ما اتفتح",
        "رسوم إضافية",
        "أرجع فلوسي"
      ],
      "keywords_ye": [
        "اشتي زلطي",
        "رجعوا زلطي",
        "الزلط ما وصلت",
        "حاسبتوني غلط"
      ]
    },
    {
      "id": "quality",
      "severity": "high",
      "sla_minutes": 60,
      "reason": "شكوى جودة تحتاج تشخيصًا بشريًا قبل أي رد.",
      "keywords": [
        "الموقع ما يفتح",
        "الموقع واقف",
        "الموقع بطيء",
        "الصور غلط",
        "المحتوى غير صحيح",
        "غلط في المعلومات",
        "ما نشرتوا",
        "المنشور ما نزل",
        "الرد ما وصل",
        "خدمة سيئة",
        "الخدمة سيئة",
        "لا أحد يرد",
        "مش راضي",
        "زعلان"
      ],
      "keywords_ye": [
        "ليش ما نزل المنشور",
        "مش عاجبني",
        "ما حد يرد",
        "الموقع مش شغال"
      ]
    },
    {
      "id": "legal",
      "severity": "critical",
      "sla_minutes": 15,
      "reason": "أي ادعاء قانوني يوقف الوكيل فورًا ويستدعي المراجعة.",
      "keywords": [
        "محامي",
        "قضية",
        "دعوى",
        "شكوى رسمية",
        "مخالفة",
        "غرامة",
        "علامة تجارية",
        "انتحال",
        "تشهير",
        "احذفوا بياناتي"
      ],
      "keywords_ye": [
        "بشتكيكم",
        "بارفع عليكم",
        "النيابة"
      ]
    },
    {
      "id": "safety",
      "severity": "critical",
      "sla_minutes": 15,
      "reason": "أي إشارة اختراق تستدعي عزل الحساب وإلغاء المفاتيح.",
      "keywords": [
        "اختراق",
        "هاك",
        "مسروق",
        "كلمة السر",
        "الحساب اتقفل",
        "دخل عليّ أحد",
        "منشور غريب",
        "رسائل ما أرسلتها",
        "رابط مشبوه",
        "محتوى مسيء",
        "تحرش",
        "تهديد"
      ],
      "keywords_ye": [
        "حد دخل على الحساب",
        "مش انا اللي نشرت"
      ]
    },
    {
      "id": "refund",
      "severity": "high",
      "sla_minutes": 30,
      "reason": "الاسترداد والإلغاء قرار بشري فقط.",
      "keywords": [
        "ألغِ الاشتراك",
        "إلغاء الاشتراك",
        "أوقفوا الخدمة",
        "فسخ العقد",
        "استرداد كامل",
        "استرداد جزئي",
        "ما استفدت",
        "خسرت فلوسي",
        "محتالين",
        "نصب"
      ],
      "keywords_ye": [
        "ما اشتيش الخدمة",
        "وقفوا الاشتراك",
        "خسرت زلطي"
      ]
    }
  ],
  "owner_inquiry_terms": [
    "خصم",
    "تخفيض",
    "عرض",
    "عمولة",
    "كم السعر",
    "بكم",
    "الأسعار",
    "إلغاء الحجز",
    "تأخير الطلب"
  ],
  "exceptions": [
    {
      "phrase": "ما أبغى تعديل",
      "scope": "span",
      "context": "رفض تعديل لا شكوى"
    },
    {
      "phrase": "ما اشتي تعديل",
      "scope": "span",
      "context": "صيغة يمنية لرفض تعديل"
    },
    {
      "phrase": "السعر مناسب",
      "scope": "span",
      "context": "مدح لا شكوى"
    },
    {
      "phrase": "أرجع لكم",
      "scope": "span",
      "context": "وعد بالتواصل لا استرداد"
    }
  ],
  "triage_unknown_category": {
    "severity": "high",
    "sla_minutes": 30,
    "note": "المرحلة الثانية أعادت فئة غير معروفة: أشد مهلة بين فئات high، ويُطلب تصنيف بشري"
  },
  "acceptance": "policies/acceptance_policy.json"
}
